Unperturbed generated text,Perturbed generated text
"<|endoftext|>In summary, the study found that the number of people who were obese in the United States increased from 1.3 million in 1980 to 2.1 million in 2010. The number of obese people increased from 1.6 million in 1980 to 2.7 million","<|endoftext|>In summary, the study found that the number of people who were obese in the United States increased from 1.3 million in 1980 to 2.1 million in 2010. The number of obese people in the United States increased from 1.3 million in 1980 to"
"<|endoftext|>This essay discusses the role of the state in the development of the modern state. It is based on the work of the late Professor of Political Science, Professor of Economics, and Professor of History, John M. O'Sullivan. The state is a social","<|endoftext|>This essay discusses the role of the Church in the development of the Church's doctrine and practice. It is based on the writings of the Church Fathers, and is intended to be a comprehensive study of the Church's history and doctrine. The Church's history is"
"<|endoftext|>Views on the issue of whether the United States should intervene in Syria have been mixed. Some Republicans, including Sen. John McCain (R-Ariz.), have said the United States should not intervene in Syria, while others, including Sen. Lindsey Graham (R","<|endoftext|>Views on the issue of whether or not to allow gay marriage in the United States have been mixed.

A recent poll by the Pew Research Center found that 52 percent of Americans support gay marriage, while only 39 percent oppose it.

The poll also"
<|endoftext|>The connection between the two is not just a matter of the two countries' economic interests. It is also a matter of the two countries' values. The United States is a country that values freedom and democracy. It is a country that values the rule,"<|endoftext|>The connection between the two is not just a matter of the two countries' nationalities. It is also a matter of the two countries' values.

The United States is a nation of immigrants. It is a nation of people who come from all over"
"<|endoftext|>Foundational to this is the fact that the world is not a single entity. It is a collection of individuals, groups, and nations. The world is not a single entity, but rather a collection of nations, states, and nations. The world is not a","<|endoftext|>Foundational to this is the idea that the human mind is a complex system of interconnected parts. The brain is a collection of neurons, synapses, and synapses. The brain is a complex system of interconnected parts. The brain is a complex system of interconnected parts. The"
"<|endoftext|>To review, the following is a list of the most common types of ""fraudulent"" or ""malicious"" software used to steal money from banks and other financial institutions. The following is a list of the most common types of ""fraudulent","<|endoftext|>To review, the following is a list of the most common types of ""fairy"" creatures in the game.

Contents show]

Fairy creatures Edit

Fairy creatures are creatures that are not normally considered to be fairy creatures. They are"
"<|endoftext|>In brief, the new version of the Windows 10 Creators Update includes a number of improvements to the Windows Store, including a new version of the Windows Store app, a new version of the Windows Store app for Windows 10 Mobile, and a new version of the Windows","<|endoftext|>In brief, the new version of the Windows 10 Creators Update includes a number of improvements and bug fixes.

The biggest change is the introduction of the new Windows 10 Creators Update, which is available to download today. The Creators Update is a major"
"<|endoftext|>An illustration of the new ""super-sized"" solar panels that will be installed on the roof of the new solar farm in the town of Krakow, Poland. (Photo: Krakow Solar Farm) The solar farm in Poland is about to","<|endoftext|>An illustration of the new ""Star Wars"" movie poster. (Photo: Lucasfilm)

The new ""Star Wars"" movie poster is a bit of a departure from the previous one, but it's still pretty cool.

The poster features a bunch"
"<|endoftext|>Furthermore, the study found that the number of people who were obese in the United States increased from 1.3 million in 1980 to 2.1 million in 2010. The increase in obesity rates is not due to a change in the number of obese","<|endoftext|>Furthermore, the report said, the government has not provided any evidence to support its claim that the government has been ""unfair"" to the company.

""The government has not provided any evidence to support its claim that the government has been unfair to the"
"<|endoftext|>The central theme of the book is that the United States is not a democracy, but a dictatorship. The book is a critique of the American political system, and the author's argument is that the United States is a dictatorship because it is a dictatorship. The","<|endoftext|>The central theme of the book is that the United States is not a democracy. It is a republic, and the Constitution is a document that is supposed to be the supreme law of the land.

The book is a collection of essays by a number of prominent"
"<|endoftext|>To conclude, I would like to say that I am very grateful to the people who have supported me in my journey. I am very grateful to my family, friends, and colleagues. I am very grateful to my fans. I am very grateful to my fans for","<|endoftext|>To conclude, I would like to say that I am very grateful to the people of the United States for their support and for their willingness to help me. I am grateful to God for His grace and His mercy. I am grateful to God for His grace and His"
"<|endoftext|>The key aspect of the new law is that it will allow the government to impose a minimum wage of $15 an hour, which is higher than the $10.10 an hour that the federal minimum wage is set to be in 2017. The government has","<|endoftext|>The key aspect of the new law is that it will allow the government to impose a minimum wage of $15 an hour on all workers, regardless of their age, gender or occupation.

The law will also allow the government to impose a minimum wage of $"
"<|endoftext|>Prior to this year's election, the Republican Party had a clear advantage in the state of Ohio. The GOP had a majority in both houses of the state legislature, and the governor was a Republican. But in the last few weeks, the GOP has lost","<|endoftext|>Prior to this year, the U.S. government had been using a program called the National Security Agency's PRISM program to collect data on millions of Americans. The program was designed to help the NSA collect information on foreign intelligence targets, but it has been used"
<|endoftext|>Emphasised are the differences between the two groups. The study found that the majority of people who had been diagnosed with depression were not taking any medication. The study also found that people who had been diagnosed with depression were more likely to be taking antidepressants,"<|endoftext|>Emphasised are the words ""I am"" and ""I am not"".

The words ""I am"" and ""I am not"" are used to indicate that the person is not a member of the Church of Jesus Christ of Latter-day Saints."
"<|endoftext|>To summarise, the main problem with the current system is that it is not designed to deal with the problem of the ""unfair"" distribution of income. The system is designed to deal with the problem of the ""unfair"" distribution of income.","<|endoftext|>To summarise, the main problem with the current system is that it is too easy to get caught up in the hype and the hype is too easy to get caught up in the hype.

The hype is that the game is going to be a huge hit"
"<|endoftext|>The relationship between the United States and Israel is one of the most important in the world. The United States has been Israel's closest ally since the end of World War II. The two countries have been at odds over the years over the Middle East, the Middle","<|endoftext|>The relationship between the United States and Israel is one of the most important in the world. It is the foundation of our national security and the foundation of our relationship with the rest of the world.

The United States has a long history of working with Israel"
"<|endoftext|>More importantly, the new rules will allow the government to use the money to pay for the cost of the new rail line, which will be built by the private sector. The government has already spent $1.5 billion on the line, which will run","<|endoftext|>More importantly, the new rules will allow the government to use the money to pay for the new rail line, which will run from the city of London to the north of Scotland.

The government has already spent £1.5bn on the project, which"
<|endoftext|>It has been shown that the brain is able to process information in a way that is not easily explained by the brain's usual processes. This is because the brain is able to process information in a way that is not easily explained by the brain's usual processes.,"<|endoftext|>It has been shown that the brain is able to process information in a way that is not necessarily the same as what is being processed by the brain. This is called the ""neural plasticity"" hypothesis.

Neural plasticity is a theory that suggests that"
"<|endoftext|>The issue focused on the use of the term ""white privilege"" to describe the privilege of being white. The issue focused on the use of the term ""white privilege"" to describe the privilege of being white. The issue focused on the use of the","<|endoftext|>The issue focused on the use of the term ""Islamophobia"" in the United States, and whether it was a legitimate term to use.

The Supreme Court ruled in favor of the government in a case involving the use of the term ""Islamophobia"" in the"
"<|endoftext|>In this essay, I will discuss the role of the state in the development of the modern state. I will argue that the state is not a necessary condition for the development of the modern state, but rather a necessary condition for the development of the modern state. I","<|endoftext|>In this essay, I will discuss the role of the Church in the development of the Church's doctrine and practice. I will also discuss the Church's role in the development of the Church's teaching and practice.

The Church's Role in the Development of Church"