Unperturbed generated text,Perturbed generated text
"<|endoftext|>In summary, the study found that the number of people who were obese in the United States increased from 1.3 million in 1980 to 2.1 million in 2010. The number of obese people increased from 1.6 million in 1980 to 2.7 million","<|endoftext|>In summary, the study found that the number of people who were obese in the United States increased from 1.3 million in 1980 to 2.1 million in 2010. The increase was greatest among women, who were 2.1 million more obese than in 1980"
"<|endoftext|>This essay discusses the role of the state in the development of the modern state. It is based on the work of the late Professor of Political Science, Professor of Economics, and Professor of History, John M. O'Sullivan. The state is a social","<|endoftext|>This essay discusses the history of the concept of ""theory of mind"" and its relation to the concept of ""theory of evolution."" It is based on the work of the late Dr. Richard Dawkins, who has been a leading proponent of the theory of evolution"
"<|endoftext|>Views on the issue of whether the United States should intervene in Syria have been mixed. Some Republicans, including Sen. John McCain (R-Ariz.), have said the United States should not intervene in Syria, while others, including Sen. Lindsey Graham (R","<|endoftext|>Views on the issue of whether the United States should intervene in Syria have been mixed. Some have argued that the United States should not intervene because it would be a mistake, while others have argued that the United States should intervene because it would be a mistake to intervene"
<|endoftext|>The connection between the two is not just a matter of the two countries' economic interests. It is also a matter of the two countries' values. The United States is a country that values freedom and democracy. It is a country that values the rule,"<|endoftext|>The connection between the two is not just a matter of the physical world. The two are also intimately connected.

The two are intimately connected.

The two are intimately connected.

The two are intimately connected.

The two are intimately"
"<|endoftext|>Foundational to this is the fact that the world is not a single entity. It is a collection of individuals, groups, and nations. The world is not a single entity, but rather a collection of nations, states, and nations. The world is not a","<|endoftext|>Foundational to this is the fact that the human brain is a complex organ. It is composed of many different cells, each with their own functions and functions. The brain is a complex organ, and it is not a single cell. It is a collection of cells, each"
"<|endoftext|>To review, the following is a list of the most common types of ""fraudulent"" or ""malicious"" software used to steal money from banks and other financial institutions. The following is a list of the most common types of ""fraudulent","<|endoftext|>To review, the following is a list of the most common types of data that are stored in the database.

Data types

Data types are the data types that are stored in the database. They are the data types that are stored in the database."
"<|endoftext|>In brief, the new version of the Windows 10 Creators Update includes a number of improvements to the Windows Store, including a new version of the Windows Store app, a new version of the Windows Store app for Windows 10 Mobile, and a new version of the Windows","<|endoftext|>In brief, the new study found that the number of people who were obese in the United States increased from 2000 to 2010, and that the increase was driven by a rise in the number of obese people.

The study, published in the journal Obesity, found"
"<|endoftext|>An illustration of the new ""super-sized"" solar panels that will be installed on the roof of the new solar farm in the town of Krakow, Poland. (Photo: Krakow Solar Farm) The solar farm in Poland is about to","<|endoftext|>An illustration of the solar system's gravitational field. Credit: NASA/JPL-Caltech/Space Science Institute

The solar system's gravitational field is a powerful force that can affect the motion of objects in the solar system. The gravitational field is a force"
"<|endoftext|>Furthermore, the study found that the number of people who were obese in the United States increased from 1.3 million in 1980 to 2.1 million in 2010. ""The increase in obesity rates is not due to a change in the number of obese","<|endoftext|>Furthermore, the study found that the number of people who were obese in the United States increased from 1.3 million in 1980 to 2.1 million in 2010.

""The increase in obesity rates in the United States is a direct result of the policies
"
"<|endoftext|>The central theme of the book is that the United States is not a democracy, but a dictatorship. The book is a critique of the American political system, and the author's argument is that the United States is a dictatorship because it is a dictatorship. The",<|endoftext|>The central theme of the book is that the world is not a place where people are free to choose their own destiny. It is a place where people are forced to choose between two choices: either to live in a world where they are free to choose their own destiny
"<|endoftext|>To conclude, I would like to say that I am very grateful to the people who have supported me in my journey. I am very grateful to my family, friends, and colleagues. I am very grateful to my fans. I am very grateful to my fans for","<|endoftext|>To conclude, we have to ask: what is the purpose of the ""science"" of evolution?

The answer is that it is a science of the creation of the universe.

The creation of the universe is the science of the creation of the universe"
"<|endoftext|>The key aspect of the new law is that it will allow the government to impose a minimum wage of $15 an hour, which is higher than the $10.10 an hour that the federal minimum wage is set to be in 2017. The government has","<|endoftext|>The key aspect of the new study is that it shows that the effects of the two drugs are not additive.

""The drugs are not additive,"" said Dr. David J. Karp, a professor of medicine at the University of California, San Francisco,"
"<|endoftext|>Prior to this year's election, the Republican Party had a clear advantage in the state of Ohio. The GOP had a majority in both houses of the state legislature, and the governor was a Republican. But in the last few weeks, the GOP has lost","<|endoftext|>Prior to this year, the U.S. had the highest rate of gun ownership in the world. In 2013, the rate was just over half that of the next-highest country, China.

The U.S. has a long history of gun"
<|endoftext|>Emphasised are the differences between the two groups. The study found that the majority of people who had been diagnosed with depression were not taking any medication. The study also found that people who had been diagnosed with depression were more likely to be taking antidepressants,"<|endoftext|>Emphasised are the differences between the two groups.

The study, published in the journal PLOS ONE, found that the more people who were overweight or obese, the more likely they were to be diagnosed with depression.

The researchers also found that people"
"<|endoftext|>To summarise, the main problem with the current system is that it is not designed to deal with the problem of the ""unfair"" distribution of income. The system is designed to deal with the problem of the ""unfair"" distribution of income.","<|endoftext|>To summarise, the main problem with the current system is that it is not sufficiently flexible to allow for the development of new technologies. The current system is not flexible enough to allow for the development of new technologies.

The current system is not flexible enough to"
"<|endoftext|>The relationship between the United States and Israel is one of the most important in the world. The United States has been Israel's closest ally since the end of World War II. The two countries have been at odds over the years over the Middle East, the Middle","<|endoftext|>The relationship between the number of people in a population and the number of deaths is a complex one. The number of deaths is a measure of the number of people who die, and the number of deaths is a measure of the number of people who live. The"
"<|endoftext|>More importantly, the new rules will allow the government to use the money to pay for the cost of the new rail line, which will be built by the private sector. The government has already spent $1.5 billion on the line, which will run","<|endoftext|>More importantly, the new study shows that the effects of the chemical are not limited to the brain.

""We found that the chemical also affects the immune system, which is important for the development of immune cells,"" said study co-author Dr. David J"
<|endoftext|>It has been shown that the brain is able to process information in a way that is not easily explained by the brain's usual processes. This is because the brain is able to process information in a way that is not easily explained by the brain's usual processes.,"<|endoftext|>It has been shown that the brain is able to process information in a way that is not easily explained by the brain's usual processes. This is because the brain is able to process information in a way that is not easily explained by the brain's usual processes.
"
"<|endoftext|>The issue focused on the use of the term ""white privilege"" to describe the privilege of being white. The issue focused on the use of the term ""white privilege"" to describe the privilege of being white. The issue focused on the use of the","<|endoftext|>The issue focused on the fact that the government had not been able to provide the information needed to determine whether the data was genuine or not.

The data was collected from the National Crime Records Bureau (NCRB) and the National Crime Records Bureau (NCRB)"
"<|endoftext|>In this essay, I will discuss the role of the state in the development of the modern state. I will argue that the state is not a necessary condition for the development of the modern state, but rather a necessary condition for the development of the modern state. I","<|endoftext|>In this essay, I will discuss the role of the media in the development of the modern world. I will argue that the media has been a major factor in the development of modernity, and that the media has been a major factor in the development of modernity"