Unperturbed generated text,Perturbed generated text
"<|endoftext|>In summary, the study found that the number of people who were obese in the United States increased from 1.3 million in 1980 to 2.1 million in 2010. The number of obese people increased from 1.6 million in 1980 to 2.7 million","<|endoftext|>In summary, the study found that the number of people who were obese in the United States increased from 1.3 million in 1980 to 2.1 million in 2010. The number of obese people increased from 1.3 million in 1980 to 2.1 million"
"<|endoftext|>This essay discusses the role of the state in the development of the modern state. It is based on the work of the late Professor of Political Science, Professor of Economics, and Professor of History, John M. O'Sullivan. The state is a social","<|endoftext|>This essay discusses the role of the media in the development of the modern media culture. It is based on the work of the media historian, John M. Dvorak, and the work of the media scholar, John M. Dvorak, Jr."
"<|endoftext|>Views on the issue of whether the United States should intervene in Syria have been mixed. Some Republicans, including Sen. John McCain (R-Ariz.), have said the United States should not intervene in Syria, while others, including Sen. Lindsey Graham (R","<|endoftext|>Views on the issue are mixed.

""I think it's a good idea,"" said David L. Cohen, a professor of political science at the University of California, Berkeley. ""I think it's a good idea for the public to know what's"
<|endoftext|>The connection between the two is not just a matter of the two countries' economic interests. It is also a matter of the two countries' values. The United States is a country that values freedom and democracy. It is a country that values the rule,"<|endoftext|>The connection between the two is not just a matter of the physical location of the two. The two are also connected by a network of connections.

The network of connections is the Internet. The Internet is a network of computers that are connected to each other"
"<|endoftext|>Foundational to this is the fact that the world is not a single entity. It is a collection of individuals, groups, and nations. The world is not a single entity, but rather a collection of nations, states, and nations. The world is not a",<|endoftext|>Foundational to this is the fact that the world is a complex system of interconnected systems. The world is a network of interconnected systems. The world is a network of interconnected systems. The world is a network of interconnected systems. The world is a network of interconnected systems. The
"<|endoftext|>To review, the following is a list of the most common types of ""fraudulent"" or ""malicious"" software used to steal money from banks and other financial institutions. The following is a list of the most common types of ""fraudulent","<|endoftext|>To review, the following is a list of the most common types of errors that can occur when using the command line interface.

Error Description Error Type Description -h, --help Show this help message and exit. -v, --version Show the version number"
"<|endoftext|>In brief, the new version of the Windows 10 Creators Update includes a number of improvements to the Windows Store, including a new version of the Windows Store app, a new version of the Windows Store app for Windows 10 Mobile, and a new version of the Windows","<|endoftext|>In brief, the new version of the Windows 10 operating system is now available for download.

The new version of Windows 10 is available for download from the Windows Store.

The new version of Windows 10 is available for download from the Windows Store.
"
"<|endoftext|>An illustration of the new ""super-sized"" solar panels that will be installed on the roof of the new solar farm in the town of Krakow, Poland. (Photo: Krakow Solar Farm) The solar farm in Poland is about to","<|endoftext|>An illustration of the new ""smart"" phone app that allows users to track their location and track their friends. (Photo: AP)

The U.S. government is launching a new app that allows users to track their location and track their friends.
"
"<|endoftext|>Furthermore, the study found that the number of people who were obese in the United States increased from 1.3 million in 1980 to 2.1 million in 2010. ""The increase in obesity rates is not due to a change in the number of obese","<|endoftext|>Furthermore, the study found that the number of people who reported having used marijuana in the past month was higher among those who had used it in the past year.

""The findings suggest that marijuana use is associated with a greater likelihood of using marijuana in the"
"<|endoftext|>The central theme of the book is that the United States is not a democracy, but a dictatorship. The book is a critique of the American political system, and the author's argument is that the United States is a dictatorship because it is a dictatorship. The",<|endoftext|>The central theme of the book is that the world is not a place where people are free to choose their own path. It is a place where people are forced to choose between two paths: the path of the individual and the path of the group. The book is
"<|endoftext|>To conclude, I would like to say that I am very grateful to the people who have supported me in my journey. I am very grateful to my family, friends, and colleagues. I am very grateful to my fans. I am very grateful to my fans for","<|endoftext|>To conclude, we have to ask: what is the purpose of the ""new"" and ""old"" in the word ""new""?

The ""new"" is a word that has been around for a long time. It is used in the sense of a"
"<|endoftext|>The key aspect of the new law is that it will allow the government to impose a minimum wage of $15 an hour, which is higher than the $10.10 an hour that the federal minimum wage is set to be in 2017. The government has","<|endoftext|>The key aspect of the new system is that it will be able to detect and respond to the presence of malware on the network.

The new system will be able to detect and respond to the presence of malware on the network.

The new system will"
"<|endoftext|>Prior to this year's election, the Republican Party had a clear advantage in the state of Ohio. The GOP had a majority in both houses of the state legislature, and the governor was a Republican. But in the last few weeks, the GOP has lost","<|endoftext|>Prior to this year, the U.S. had the highest rate of gun ownership in the world. In 2013, the rate was just over half that of the next-highest country, China.

The U.S. has the highest rate of gun"
<|endoftext|>Emphasised are the differences between the two groups. The study found that the majority of people who had been diagnosed with depression were not taking any medication. The study also found that people who had been diagnosed with depression were more likely to be taking antidepressants,"<|endoftext|>Emphasised are the differences between the two types of data.

The data are presented in a table format, with the data grouped by the data type.

The data are grouped by the data type.

The data are grouped by the data type"
"<|endoftext|>To summarise, the main problem with the current system is that it is not designed to deal with the problem of the ""unfair"" distribution of income. The system is designed to deal with the problem of the ""unfair"" distribution of income.","<|endoftext|>To summarise, the main problem with the current system is that it is too slow. The speed of the CPU is not the main issue, but the CPU is not fast enough to handle all the tasks that are being executed.

The main problem with the"
"<|endoftext|>The relationship between the United States and Israel is one of the most important in the world. The United States has been Israel's closest ally since the end of World War II. The two countries have been at odds over the years over the Middle East, the Middle","<|endoftext|>The relationship between the two is not as simple as it seems.

The first thing to understand is that the relationship between the two is not as simple as it seems.

The relationship between the two is not as simple as it seems."
"<|endoftext|>More importantly, the new rules will allow the government to use the money to pay for the cost of the new rail line, which will be built by the private sector. The government has already spent $1.5 billion on the line, which will run","<|endoftext|>More importantly, the new system will allow the company to offer a more comprehensive range of products, including a range of smart home products, smart home accessories and smart home software.

The company will also be launching a new smart home product called the Smart Home Hub"
<|endoftext|>It has been shown that the brain is able to process information in a way that is not easily explained by the brain's usual processes. This is because the brain is able to process information in a way that is not easily explained by the brain's usual processes.,<|endoftext|>It has been shown that the brain is able to process information in a way that is not necessarily the same as what is being processed by the brain. This is because the brain is able to process information in a way that is not necessarily the same as what is being processed
"<|endoftext|>The issue focused on the use of the term ""white privilege"" to describe the privilege of being white. The issue focused on the use of the term ""white privilege"" to describe the privilege of being white. The issue focused on the use of the","<|endoftext|>The issue focused on the use of the term ""gay"" in the context of the Bible.

The Supreme Court ruled in June that the term ""gay"" is protected by the First Amendment.

The court said that the term ""gay"" is not a"
"<|endoftext|>In this essay, I will discuss the role of the state in the development of the modern state. I will argue that the state is not a necessary condition for the development of the modern state, but rather a necessary condition for the development of the modern state. I","<|endoftext|>In this essay, I will discuss the history of the concept of ""theory of mind"" and its relationship to the concept of ""theory of computation."" I will also discuss the implications of the concept of ""theory of computation"" for the development of computer"